{
  "$schema": "https://json-schema.org/draft/2020-12/schema",
  "$id": "https://webdev-bench.local/schemas/design-doc.schema.json",
  "title": "design-doc",
  "description": "Minimal design specification for one webdev-bench site. Produced by the author prompt (recipe/01-generate/prompts/author.md), consumed by the builder. The grader does NOT read this — precompute extracts reference values from the rendered ground-truth.",
  "type": "object",
  "additionalProperties": false,
  "required": ["description", "allowed_frameworks", "palette", "pages"],
  "properties": {
    "description": {
      "type": "string",
      "minLength": 10,
      "description": "One-line meaning of the website — what it is and what it represents. Example: 'Dashboard for fintech analytics tracking trading performance across portfolios'."
    },
    "allowed_frameworks": {
      "type": "array",
      "minItems": 1,
      "uniqueItems": true,
      "items": {
        "enum": ["html-css", "react-css", "react-tailwind", "solid-tailwind"]
      },
      "description": "Frameworks the agent is allowed to use. For this benchmark, always ['html-css']. The framework_compliance gate (×0.3) enforces this at grade time."
    },
    "palette": {
      "type": "object",
      "additionalProperties": false,
      "required": ["background", "surface", "text", "accent"],
      "description": "Concrete color palette the builder must use. Carried in design.json so generated designs don't all converge on the same warm-cream default. Agent never sees this field (it's isolated to the verifier container); it's consumed by the builder only.",
      "properties": {
        "background": { "type": "string", "pattern": "^#[0-9a-fA-F]{6}$", "description": "Page background." },
        "surface":    { "type": "string", "pattern": "^#[0-9a-fA-F]{6}$", "description": "Card / panel / sidebar background, distinct from page bg (~5-15% lightness offset)." },
        "text":       { "type": "string", "pattern": "^#[0-9a-fA-F]{6}$", "description": "Primary body text color. Must have ≥ 4.5:1 contrast against background." },
        "accent":     { "type": "string", "pattern": "^#[0-9a-fA-F]{6}$", "description": "Primary brand color — buttons, links, active states. Use sparingly." },
        "accent_alt": { "type": "string", "pattern": "^#[0-9a-fA-F]{6}$", "description": "Optional secondary accent — a status color or complementary brand color." },
        "muted":      { "type": "string", "pattern": "^#[0-9a-fA-F]{6}$", "description": "Optional secondary text / borders / disabled state." }
      }
    },
    "pages": {
      "type": "array",
      "minItems": 5,
      "maxItems": 6,
      "items": {
        "type": "object",
        "additionalProperties": false,
        "required": ["name", "description", "components", "animations"],
        "properties": {
          "name": {
            "type": "string",
            "pattern": "^[a-z][a-z0-9-]*$",
            "description": "Lowercase kebab-case; becomes <name>.html per the canonical-filename convention."
          },
          "description": {
            "type": "string",
            "minLength": 10,
            "description": "One-line purpose of this page."
          },
          "components": {
            "type": "array",
            "minItems": 3,
            "maxItems": 5,
            "items": {
              "type": "string",
              "minLength": 5,
              "maxLength": 250
            },
            "description": "Three to five components, ordered top-to-bottom on the page. Each component is a single sentence (≤ 250 chars). Forces complexity to spread across pages, not pile up on one."
          },
          "animations": {
            "type": "array",
            "minItems": 1,
            "maxItems": 1,
            "description": "Exactly one animation per page (Part 2 contract). The animation lives on a SMALL, bounded widget that sits ABOVE the fold at desktop 1440×900 — inside the hero or top component — so the user sees the entrance fire on first paint. Closed-enum taxonomy so the builder maps each type to a fixed @keyframes template.",
            "items": {
              "type": "object",
              "additionalProperties": false,
              "required": ["element", "type", "trigger", "duration_ms", "easing"],
              "properties": {
                "element": {
                  "type": "string",
                  "minLength": 8,
                  "maxLength": 160,
                  "description": "One short phrase identifying the small animated widget AND naming where on the page it sits. The widget MUST be **above the desktop fold (y < 900)** — typically a hero CTA button, a kicker/eyebrow label above the hero headline, a hero status pill, a top-nav action button, or a primary first-section badge — so the on-load entrance is visible on first paint. Good examples: 'Primary Get started CTA button inside the hero block'; 'Eyebrow kicker label above the hero headline'; 'Status pill in the top navigation bar'. Bad examples (below the fold — DO NOT pick these): 'Footer trust strip'; 'Last review card'; 'Pagination bar at the bottom of the list'. The builder uses this to (a) place the small element inside the hero or top component, and (b) apply the wdvb-anim-<type>-<page-name> class to THAT element specifically."
                },
                "type": {
                  "enum": ["slide-up", "slide-down", "slide-left", "slide-right", "scale-up"],
                  "description": "Entrance animation class. Each starts off-screen / off-scale and translates or scales into final position, with opacity fading 0 → 1. slide-up: starts 120 px below + opacity 0 (rises into place). slide-down: starts 120 px above + opacity 0 (drops into place). slide-left: starts 120 px to the right + opacity 0 (comes from the right). slide-right: starts 120 px to the left + opacity 0 (comes from the left). scale-up: starts at scale(0.6) + opacity 0 (grows into place). Directional slides are 'hard to miss' because the element visibly traverses screen distance."
                },
                "trigger": {
                  "enum": ["load"],
                  "description": "Load-triggered only (Part 2 contract). The animation fires once on page load — it is visible on first paint because the widget sits above the fold."
                },
                "duration_ms": {
                  "type": "integer",
                  "minimum": 1000,
                  "maximum": 2000,
                  "description": "Animation duration in milliseconds. 1200–1500 ms is the sweet spot — long enough that the 120 px translation is unmissable, short enough not to feel sluggish on page load."
                },
                "easing": {
                  "enum": ["linear", "ease-in", "ease-out", "ease-in-out"],
                  "description": "CSS timing function. 'ease-out' is the default for entrances (fast at the start, decelerating into place). 'ease-in-out' fits scale-up well. Avoid 'linear' for entrances — it looks mechanical."
                }
              }
            }
          }
        }
      }
    }
  }
}
